{
  "$schema": "https://json-schema.org/draft/2020-12/schema",
  "$id": "https://waymark.local/schemas/survey_simulation_fake_profile_v0_1.json",
  "title": "Survey Simulation Fake Profile v0.1",
  "type": "object",
  "additionalProperties": false,
  "required": [
    "schema_version",
    "fake_profile_id",
    "display_label",
    "summary",
    "primary_archetype_affinities",
    "secondary_archetype_affinities",
    "context_lane",
    "false_nearby_lane",
    "hidden_anti_affinities",
    "apple_payload_id",
    "hidden_reaction_corpus_id"
  ],
  "properties": {
    "schema_version": {
      "const": "survey_simulation.fake_profile.v0.1"
    },
    "fake_profile_id": {
      "type": "string",
      "pattern": "^fake_profile_\\d{2}$"
    },
    "display_label": {
      "type": "string",
      "minLength": 1
    },
    "summary": {
      "type": "string",
      "minLength": 1
    },
    "primary_archetype_affinities": {
      "type": "array",
      "minItems": 2,
      "maxItems": 2,
      "items": {
        "type": "object",
        "additionalProperties": false,
        "required": [
          "archetype_id",
          "weight",
          "note"
        ],
        "properties": {
          "archetype_id": {
            "type": "string",
            "pattern": "^\\d{3}$"
          },
          "weight": {
            "type": "number",
            "minimum": 0,
            "maximum": 1
          },
          "note": {
            "type": "string",
            "minLength": 1
          }
        }
      }
    },
    "secondary_archetype_affinities": {
      "type": "array",
      "minItems": 2,
      "maxItems": 2,
      "items": {
        "type": "object",
        "additionalProperties": false,
        "required": [
          "archetype_id",
          "weight",
          "note"
        ],
        "properties": {
          "archetype_id": {
            "type": "string",
            "pattern": "^\\d{3}$"
          },
          "weight": {
            "type": "number",
            "minimum": 0,
            "maximum": 1
          },
          "note": {
            "type": "string",
            "minLength": 1
          }
        }
      }
    },
    "context_lane": {
      "type": "object",
      "additionalProperties": false,
      "required": [
        "lane_id",
        "display_name",
        "note"
      ],
      "properties": {
        "lane_id": {
          "type": "string",
          "minLength": 1
        },
        "display_name": {
          "type": "string",
          "minLength": 1
        },
        "note": {
          "type": "string",
          "minLength": 1
        },
        "archetype_id": {
          "type": "string",
          "pattern": "^\\d{3}$"
        },
        "family_number": {
          "type": "integer",
          "minimum": 1
        }
      }
    },
    "false_nearby_lane": {
      "type": "object",
      "additionalProperties": false,
      "required": [
        "lane_id",
        "display_name",
        "note"
      ],
      "properties": {
        "lane_id": {
          "type": "string",
          "minLength": 1
        },
        "display_name": {
          "type": "string",
          "minLength": 1
        },
        "note": {
          "type": "string",
          "minLength": 1
        },
        "archetype_id": {
          "type": "string",
          "pattern": "^\\d{3}$"
        },
        "family_number": {
          "type": "integer",
          "minimum": 1
        }
      }
    },
    "hidden_anti_affinities": {
      "type": "array",
      "minItems": 1,
      "items": {
        "type": "object",
        "additionalProperties": false,
        "required": [
          "archetype_id",
          "weight",
          "note"
        ],
        "properties": {
          "archetype_id": {
            "type": "string",
            "pattern": "^\\d{3}$"
          },
          "weight": {
            "type": "number",
            "minimum": 0,
            "maximum": 1
          },
          "note": {
            "type": "string",
            "minLength": 1
          }
        }
      }
    },
    "apple_payload_id": {
      "type": "string",
      "pattern": "^apple_payload_\\d{2}$"
    },
    "hidden_reaction_corpus_id": {
      "type": "string",
      "pattern": "^hidden_corpus_\\d{2}$"
    }
  }
}
